{
  "network_type": "AE",
  "dataset_type": "texture_1",
  "subtest_folder": "defective",
  "vis_results": true,
  "vis_reconstruction": true,
  "grayscale": false,
  "img_size": [256, 256],
  "crop_size": [128, 128],
  "stride": 32,
  "device": "cuda",
  "threshold_init": 0.01,
  "threshold_end": 1.01,
  "num_of_steps": 50
}
