{
  "network_type": "AEE",
  "dataset_type": "cpu",
  "subtest_folder": "cpua",
  "vis_results": false,
  "vis_reconstruction": false,
  "grayscale": false,
  "img_size": [256, 256],
  "crop_size": [128, 128],
  "stride": 32,
  "device": "cuda",
  "threshold_init": 0.01,
  "threshold_end": 1.01,
  "num_of_steps": 50
}
